[
  {
    "id": "draft_northstar_ops_studio_first_touch",
    "account_id": "acct_northstar_ops_studio",
    "draft_type": "first_touch",
    "subject_options": [
      "Pipeline sprint idea for Northstar Ops Studio",
      "Evidence-backed follow-up workflow"
    ],
    "body": "Hi Maya,\n\nI noticed Northstar Ops Studio looks like a fit for a supervised pipeline sprint based on this workspace note: Founder sells RevOps retainers.\nI am using Maya Chen (Founder) as the tentative recipient from local contact context: Operator-provided tentative buyer because she owns RevOps retainer sales and follow-up process.\n\n\nLead with evidence-backed lead briefs and review-gated drafts for solo consultant operators.\n\nThe useful starting point would be a small, local run: import a target list, generate evidence-backed lead briefs, draft follow-ups for review, and produce a weekly report. Nothing is sent automatically.\n\nWould it be worth comparing this against your current follow-up process for a few accounts?\n\nFranklin",
    "status": "approved",
    "contact_id": "contact_acct_northstar_ops_studio_maya_chen",
    "contact_name": "Maya Chen",
    "contact_role": "Founder",
    "interaction_id": "",
    "interaction_summary": "",
    "evidence_ids": [
      "ev_northstar_ops_studio_website",
      "ev_northstar_ops_studio_segment",
      "ev_northstar_ops_studio_note_1"
    ],
    "risk_flags": [
      "Missing: Recent public proof beyond operator notes"
    ],
    "suggested_send_window": "Operator-selected after manual review",
    "next_action_if_no_reply": "Wait 5 business days, then draft one low-pressure follow-up only if still relevant.",
    "created_at": "2026-06-11T22:30:00.000Z",
    "updated_at": "2026-06-11T22:45:00.000Z",
    "review_note": "Approved after manual recipient confirmation outside fixture."
  },
  {
    "id": "draft_brightlane_creative_warm_follow_up",
    "account_id": "acct_brightlane_creative",
    "draft_type": "warm_follow_up",
    "subject_options": [
      "Following up on Brightlane Creative",
      "Next step from our notes"
    ],
    "body": "Hi Andre,\n\nFollowing up on prior context for Brightlane Creative: Andre asked for a short example of how an agency referral pipeline report would look after a discovery call.\nI am using Andre Lewis (Managing Partner) as the tentative recipient from local contact context: Operator-provided agency decision-maker for pipeline process and referral analytics.\nPrior context from the workspace: Andre asked for a short example of how an agency referral pipeline report would look after a discovery call.\n\nLead with a local pipeline sprint for boutique agency teams that connects research quality, follow-up review, and weekly analytics.\n\nThe useful next step from the local notes is: Send a concise follow-up with one agency-specific proof point and offer a three-account sample. Nothing is sent automatically.\n\nWould it be worth taking the next step from here?\n\nFranklin",
    "status": "superseded",
    "contact_id": "contact_acct_brightlane_creative_andre_lewis",
    "contact_name": "Andre Lewis",
    "contact_role": "Managing Partner",
    "interaction_id": "interaction_acct_brightlane_creative",
    "interaction_summary": "Andre asked for a short example of how an agency referral pipeline report would look after a discovery call.",
    "evidence_ids": [
      "ev_brightlane_creative_website",
      "ev_brightlane_creative_segment",
      "ev_brightlane_creative_note_1"
    ],
    "risk_flags": [
      "Missing: Recent public proof beyond operator notes"
    ],
    "suggested_send_window": "Operator-selected after manual review",
    "next_action_if_no_reply": "Send a concise follow-up with one agency-specific proof point and offer a three-account sample.",
    "created_at": "2026-06-11T22:30:00.000Z",
    "updated_at": "2026-06-11T22:46:30.000Z",
    "review_note": "Needs agency-specific proof point before use.",
    "superseded_at": "2026-06-11T22:46:30.000Z"
  },
  {
    "id": "draft_atlas_founder_labs_first_touch",
    "account_id": "acct_atlas_founder_labs",
    "draft_type": "first_touch",
    "subject_options": [
      "Pipeline sprint idea for Atlas Founder Labs",
      "Evidence-backed follow-up workflow"
    ],
    "body": "Hi Priya,\n\nI noticed Atlas Founder Labs looks like a fit for a supervised pipeline sprint based on this workspace note: Early B2B SaaS team doing founder-led sales.\nI am using Priya Raman (CEO) as the tentative recipient from local contact context: Operator-provided founder-led sales owner for demos and investor follow-ups.\n\n\nLead with evidence-backed lead briefs and review-gated drafts for founder led b2b operators.\n\nThe useful starting point would be a small, local run: import a target list, generate evidence-backed lead briefs, draft follow-ups for review, and produce a weekly report. Nothing is sent automatically.\n\nWould it be worth comparing this against your current follow-up process for a few accounts?\n\nFranklin",
    "status": "needs_review",
    "contact_id": "contact_acct_atlas_founder_labs_priya_raman",
    "contact_name": "Priya Raman",
    "contact_role": "CEO",
    "interaction_id": "",
    "interaction_summary": "",
    "evidence_ids": [
      "ev_atlas_founder_labs_website",
      "ev_atlas_founder_labs_segment",
      "ev_atlas_founder_labs_note_1"
    ],
    "risk_flags": [
      "Missing: Recent public proof beyond operator notes"
    ],
    "suggested_send_window": "Operator-selected after manual review",
    "next_action_if_no_reply": "Wait 5 business days, then draft one low-pressure follow-up only if still relevant.",
    "created_at": "2026-06-11T22:30:00.000Z",
    "updated_at": "2026-06-11T22:30:00.000Z"
  },
  {
    "id": "draft_cedar_grant_partners_meeting_recap",
    "account_id": "acct_cedar_grant_partners",
    "draft_type": "meeting_recap",
    "subject_options": [
      "Recap and next step for Cedar Grant Partners",
      "Quick recap"
    ],
    "body": "Hi Elena,\n\nThanks again for the conversation. I captured this recap context for Cedar Grant Partners: Prior conversation focused on deadline-sensitive grant follow-ups and compliance-safe language.\nI am using Elena Brooks (Principal Consultant) as the tentative recipient from local contact context: Operator-provided relationship owner with compliance-sensitive follow-up needs.\nPrior context from the workspace: Prior conversation focused on deadline-sensitive grant follow-ups and compliance-safe language.\n\nLead with a human-reviewed follow-up queue for deadline-sensitive relationship workflows.\n\nA useful next step would be to confirm the recap, review the proposed next action, and decide whether a small local sprint is worth testing. Nothing is sent automatically.\n\nDoes that match your read, and should I turn it into a small next-step plan?\n\nFranklin",
    "status": "rejected",
    "contact_id": "contact_acct_cedar_grant_partners_elena_brooks",
    "contact_name": "Elena Brooks",
    "contact_role": "Principal Consultant",
    "interaction_id": "interaction_acct_cedar_grant_partners",
    "interaction_summary": "Prior conversation focused on deadline-sensitive grant follow-ups and compliance-safe language.",
    "evidence_ids": [
      "ev_cedar_grant_partners_website",
      "ev_cedar_grant_partners_segment",
      "ev_cedar_grant_partners_note_1"
    ],
    "risk_flags": [
      "Missing: Recent public proof beyond operator notes"
    ],
    "suggested_send_window": "Operator-selected after manual review",
    "next_action_if_no_reply": "Recap the compliance concern and ask whether legal review is needed before any draft is used.",
    "created_at": "2026-06-11T22:30:00.000Z",
    "updated_at": "2026-06-11T22:47:00.000Z",
    "review_note": "Compliance-sensitive segment needs legal review before drafting."
  },
  {
    "id": "draft_harbor_it_advisors_stale_opportunity_revive",
    "account_id": "acct_harbor_it_advisors",
    "draft_type": "stale_opportunity_revive",
    "subject_options": [
      "Still worth revisiting?",
      "Reviving Harbor IT Advisors"
    ],
    "body": "Hi Marcus,\n\nI am resurfacing Harbor IT Advisors because the workspace shows a stale opportunity: Renewal follow-up idea was discussed last month but stalled before a concrete next step.\nI am using Marcus Lee (Managing Director) as the tentative recipient from local contact context: Operator-provided buyer for managed IT renewal and referral pipeline discipline.\nPrior context from the workspace: Renewal follow-up idea was discussed last month but stalled before a concrete next step.\n\nLead with a local pipeline sprint for professional services teams that connects research quality, follow-up review, and weekly analytics.\n\nThe useful starting point would be a low-pressure check-in that confirms whether the problem is still active before proposing anything. Nothing is sent automatically.\n\nIs this still worth revisiting, or should I close the loop for now?\n\nFranklin",
    "status": "edited",
    "contact_id": "contact_acct_harbor_it_advisors_marcus_lee",
    "contact_name": "Marcus Lee",
    "contact_role": "Managing Director",
    "interaction_id": "interaction_acct_harbor_it_advisors",
    "interaction_summary": "Renewal follow-up idea was discussed last month but stalled before a concrete next step.",
    "evidence_ids": [
      "ev_harbor_it_advisors_website",
      "ev_harbor_it_advisors_segment",
      "ev_harbor_it_advisors_note_1"
    ],
    "risk_flags": [
      "Missing: Recent public proof beyond operator notes"
    ],
    "suggested_send_window": "Operator-selected after manual review",
    "next_action_if_no_reply": "Ask whether renewal follow-up discipline is still worth revisiting this quarter.",
    "created_at": "2026-06-11T22:30:00.000Z",
    "updated_at": "2026-06-11T22:46:45.000Z",
    "review_note": "Needs stronger managed IT renewal context before use."
  },
  {